{
  "seriesId": "MS-L01-001",
  "seriesIri": "tmf:monitoring-series/MS-L01-001",
  "location": "tmf:location/L-01",
  "hasReferenceLocation": "tmf:location/L-05",
  "installation": "tmf:installation/INST-L01-01",
  "madeBySensor": "tmf:sensor/MC-L01-01",
  "sensorLabel": "core_short",
  "observedProperty": [
    "tmf:property/moisture-content",
    "tmf:property/relative-humidity",
    "tmf:property/air-temperature"
  ],
  "seriesStart": "2025-06-26T00:25:55.202099Z",
  "seriesEnd": "2025-06-27T23:46:50.857321Z",
  "samplingInterval": "PT1H",
  "observations": [
    {
      "observationId": "M-L01-MC-20250626T002555202Z",
      "sourceRecordId": "M-L01-20250626T002555202Z",
      "timestamp": "2025-06-26T00:25:55.202099Z",
      "observedProperty": "tmf:property/moisture-content",
      "resultValue": 13.6,
      "resultUnit": "unit:PERCENT",
      "simpleResult": "13.6 %",
      "dataQualityFlag": "Usable"
    },
    {
      "observationId": "M-L01-RH-20250626T002555202Z",
      "sourceRecordId": "M-L01-20250626T002555202Z",
      "timestamp": "2025-06-26T00:25:55.202099Z",
      "observedProperty": "tmf:property/relative-humidity",
      "resultValue": 66.0,
      "resultUnit": "unit:PERCENT",
      "simpleResult": "66.0 %",
      "dataQualityFlag": "Usable"
    },
    {
      "observationId": "M-L01-T-20250626T002555202Z",
      "sourceRecordId": "M-L01-20250626T002555202Z",
      "timestamp": "2025-06-26T00:25:55.202099Z",
      "observedProperty": "tmf:property/air-temperature",
      "resultValue": 20.2,
      "resultUnit": "unit:DEG_C",
      "simpleResult": "20.2 degC",
      "dataQualityFlag": "Usable"
    },
    {
      "observationId": "M-L01-MC-20250626T012621930Z",
      "sourceRecordId": "M-L01-20250626T012621930Z",
      "timestamp": "2025-06-26T01:26:21.930329Z",
      "observedProperty": "tmf:property/moisture-content",
      "resultValue": 13.5,
      "resultUnit": "unit:PERCENT",
      "simpleResult": "13.5 %",
      "dataQualityFlag": "Usable"
    },
    {
      "observationId": "M-L01-RH-20250626T012621930Z",
      "sourceRecordId": "M-L01-20250626T012621930Z",
      "timestamp": "2025-06-26T01:26:21.930329Z",
      "observedProperty": "tmf:property/relative-humidity",
      "resultValue": 65.0,
      "resultUnit": "unit:PERCENT",
      "simpleResult": "65.0 %",
      "dataQualityFlag": "Usable"
    },
    {
      "observationId": "M-L01-T-20250626T012621930Z",
      "sourceRecordId": "M-L01-20250626T012621930Z",
      "timestamp": "2025-06-26T01:26:21.930329Z",
      "observedProperty": "tmf:property/air-temperature",
      "resultValue": 20.3,
      "resultUnit": "unit:DEG_C",
      "simpleResult": "20.3 degC",
      "dataQualityFlag": "Usable"
    },
    {
      "observationId": "M-L01-MC-20250626T022648631Z",
      "sourceRecordId": "M-L01-20250626T022648631Z",
      "timestamp": "2025-06-26T02:26:48.631785Z",
      "observedProperty": "tmf:property/moisture-content",
      "resultValue": 13.5,
      "resultUnit": "unit:PERCENT",
      "simpleResult": "13.5 %",
      "dataQualityFlag": "Usable"
    },
    {
      "observationId": "M-L01-RH-20250626T022648631Z",
      "sourceRecordId": "M-L01-20250626T022648631Z",
      "timestamp": "2025-06-26T02:26:48.631785Z",
      "observedProperty": "tmf:property/relative-humidity",
      "resultValue": 65.0,
      "resultUnit": "unit:PERCENT",
      "simpleResult": "65.0 %",
      "dataQualityFlag": "Usable"
    },
    {
      "observationId": "M-L01-T-20250626T022648631Z",
      "sourceRecordId": "M-L01-20250626T022648631Z",
      "timestamp": "2025-06-26T02:26:48.631785Z",
      "observedProperty": "tmf:property/air-temperature",
      "resultValue": 20.3,
      "resultUnit": "unit:DEG_C",
      "simpleResult": "20.3 degC",
      "dataQualityFlag": "Usable"
    },
    {
      "observationId": "M-L01-MC-20250626T032715340Z",
      "sourceRecordId": "M-L01-20250626T032715340Z",
      "timestamp": "2025-06-26T03:27:15.340065Z",
      "observedProperty": "tmf:property/moisture-content",
      "resultValue": 13.5,
      "resultUnit": "unit:PERCENT",
      "simpleResult": "13.5 %",
      "dataQualityFlag": "Usable"
    },
    {
      "observationId": "M-L01-RH-20250626T032715340Z",
      "sourceRecordId": "M-L01-20250626T032715340Z",
      "timestamp": "2025-06-26T03:27:15.340065Z",
      "observedProperty": "tmf:property/relative-humidity",
      "resultValue": 65.0,
      "resultUnit": "unit:PERCENT",
      "simpleResult": "65.0 %",
      "dataQualityFlag": "Usable"
    },
    {
      "observationId": "M-L01-T-20250626T032715340Z",
      "sourceRecordId": "M-L01-20250626T032715340Z",
      "timestamp": "2025-06-26T03:27:15.340065Z",
      "observedProperty": "tmf:property/air-temperature",
      "resultValue": 20.3,
      "resultUnit": "unit:DEG_C",
      "simpleResult": "20.3 degC",
      "dataQualityFlag": "Usable"
    },
    {
      "observationId": "M-L01-MC-20250626T042742076Z",
      "sourceRecordId": "M-L01-20250626T042742076Z",
      "timestamp": "2025-06-26T04:27:42.076279Z",
      "observedProperty": "tmf:property/moisture-content",
      "resultValue": 13.5,
      "resultUnit": "unit:PERCENT",
      "simpleResult": "13.5 %",
      "dataQualityFlag": "Usable"
    },
    {
      "observationId": "M-L01-RH-20250626T042742076Z",
      "sourceRecordId": "M-L01-20250626T042742076Z",
      "timestamp": "2025-06-26T04:27:42.076279Z",
      "observedProperty": "tmf:property/relative-humidity",
      "resultValue": 65.0,
      "resultUnit": "unit:PERCENT",
      "simpleResult": "65.0 %",
      "dataQualityFlag": "Usable"
    },
    {
      "observationId": "M-L01-T-20250626T042742076Z",
      "sourceRecordId": "M-L01-20250626T042742076Z",
      "timestamp": "2025-06-26T04:27:42.076279Z",
      "observedProperty": "tmf:property/air-temperature",
      "resultValue": 20.3,
      "resultUnit": "unit:DEG_C",
      "simpleResult": "20.3 degC",
      "dataQualityFlag": "Usable"
    },
    {
      "observationId": "M-L01-MC-20250626T052808780Z",
      "sourceRecordId": "M-L01-20250626T052808780Z",
      "timestamp": "2025-06-26T05:28:08.780356Z",
      "observedProperty": "tmf:property/moisture-content",
      "resultValue": 13.5,
      "resultUnit": "unit:PERCENT",
      "simpleResult": "13.5 %",
      "dataQualityFlag": "Usable"
    },
    {
      "observationId": "M-L01-RH-20250626T052808780Z",
      "sourceRecordId": "M-L01-20250626T052808780Z",
      "timestamp": "2025-06-26T05:28:08.780356Z",
      "observedProperty": "tmf:property/relative-humidity",
      "resultValue": 65.0,
      "resultUnit": "unit:PERCENT",
      "simpleResult": "65.0 %",
      "dataQualityFlag": "Usable"
    },
    {
      "observationId": "M-L01-T-20250626T052808780Z",
      "sourceRecordId": "M-L01-20250626T052808780Z",
      "timestamp": "2025-06-26T05:28:08.780356Z",
      "observedProperty": "tmf:property/air-temperature",
      "resultValue": 20.3,
      "resultUnit": "unit:DEG_C",
      "simpleResult": "20.3 degC",
      "dataQualityFlag": "Usable"
    },
    {
      "observationId": "M-L01-MC-20250626T062835505Z",
      "sourceRecordId": "M-L01-20250626T062835505Z",
      "timestamp": "2025-06-26T06:28:35.505148Z",
      "observedProperty": "tmf:property/moisture-content",
      "resultValue": 13.5,
      "resultUnit": "unit:PERCENT",
      "simpleResult": "13.5 %",
      "dataQualityFlag": "Usable"
    },
    {
      "observationId": "M-L01-RH-20250626T062835505Z",
      "sourceRecordId": "M-L01-20250626T062835505Z",
      "timestamp": "2025-06-26T06:28:35.505148Z",
      "observedProperty": "tmf:property/relative-humidity",
      "resultValue": 65.0,
      "resultUnit": "unit:PERCENT",
      "simpleResult": "65.0 %",
      "dataQualityFlag": "Usable"
    },
    {
      "observationId": "M-L01-T-20250626T062835505Z",
      "sourceRecordId": "M-L01-20250626T062835505Z",
      "timestamp": "2025-06-26T06:28:35.505148Z",
      "observedProperty": "tmf:property/air-temperature",
      "resultValue": 20.3,
      "resultUnit": "unit:DEG_C",
      "simpleResult": "20.3 degC",
      "dataQualityFlag": "Usable"
    },
    {
      "observationId": "M-L01-MC-20250626T072902196Z",
      "sourceRecordId": "M-L01-20250626T072902196Z",
      "timestamp": "2025-06-26T07:29:02.196453Z",
      "observedProperty": "tmf:property/moisture-content",
      "resultValue": 13.5,
      "resultUnit": "unit:PERCENT",
      "simpleResult": "13.5 %",
      "dataQualityFlag": "Usable"
    },
    {
      "observationId": "M-L01-RH-20250626T072902196Z",
      "sourceRecordId": "M-L01-20250626T072902196Z",
      "timestamp": "2025-06-26T07:29:02.196453Z",
      "observedProperty": "tmf:property/relative-humidity",
      "resultValue": 65.0,
      "resultUnit": "unit:PERCENT",
      "simpleResult": "65.0 %",
      "dataQualityFlag": "Usable"
    },
    {
      "observationId": "M-L01-T-20250626T072902196Z",
      "sourceRecordId": "M-L01-20250626T072902196Z",
      "timestamp": "2025-06-26T07:29:02.196453Z",
      "observedProperty": "tmf:property/air-temperature",
      "resultValue": 20.4,
      "resultUnit": "unit:DEG_C",
      "simpleResult": "20.4 degC",
      "dataQualityFlag": "Usable"
    },
    {
      "observationId": "M-L01-MC-20250626T082928939Z",
      "sourceRecordId": "M-L01-20250626T082928939Z",
      "timestamp": "2025-06-26T08:29:28.939084Z",
      "observedProperty": "tmf:property/moisture-content",
      "resultValue": 13.5,
      "resultUnit": "unit:PERCENT",
      "simpleResult": "13.5 %",
      "dataQualityFlag": "Usable"
    },
    {
      "observationId": "M-L01-RH-20250626T082928939Z",
      "sourceRecordId": "M-L01-20250626T082928939Z",
      "timestamp": "2025-06-26T08:29:28.939084Z",
      "observedProperty": "tmf:property/relative-humidity",
      "resultValue": 66.0,
      "resultUnit": "unit:PERCENT",
      "simpleResult": "66.0 %",
      "dataQualityFlag": "Usable"
    },
    {
      "observationId": "M-L01-T-20250626T082928939Z",